Year,Award,Details
2023,"Most Innovative Tech Company","Awarded by TechFuture Magazine three years in a row"
2022,"Celestial VR Licensing","Licensed by top-tier educational institutions for experiential learning"
2022,"Most Innovative Tech Company","Awarded by TechFuture Magazine"
2021,"Partnership with World Health Organization (WHO)","Used Luminara Glasses in remote surgeries, allowing skilled surgeons to guide procedures from thousands of miles away"
2021,"Most Innovative Tech Company","Awarded by TechFuture Magazine"
2020,"Computational Records with QuantNet","Broke computational records solving complex genetic sequences, paving the way for groundbreaking medical treatments"
